adult,budget,homepage,id,imdb_id,original_language,original_title,overview,popularity,poster_path,release_date,revenue,runtime,status,tagline,title,video,vote_average,vote_count,genres,production_companies,production_countries,spoken_languages,belongs_to_collection,characters,cast,director,screenplay,keywords
False,53000000,,261023,tt1355683,en,Black Mass,"The true story of Whitey Bulger, the brother of a state senator and the most infamous violent criminal in the history of South Boston, who became an FBI informant to take down a Mafia family invading his turf.",10.61072,/yIVnNriiyl522hk3LFLJrrMovhP.jpg,2015-09-04,98837872.0,122.0,Released,Keep your enemies close.,Black Mass,False,6.3,1262.0,"['Crime', 'Drama']","['Infinitum Nihil', 'Head Gear Films', 'Cross Creek Pictures', 'Free State Pictures', 'RatPac-Dune Entertainment', 'Le Grisbi Productions', 'Vendian Entertainment']","['United Kingdom', 'United States of America']",['en'],,"[""James 'Whitey' Bulger"", 'John Connolly', 'Billy Bulger', 'Lindsey Cyr', 'FBI Agent Charles McGuire']","['Johnny Depp', 'Joel Edgerton', 'Benedict Cumberbatch', 'Dakota Johnson', 'Kevin Bacon']",Scott Cooper,Jez Butterworth,"['boston', 'based on true story', 'organized crime']"
False,0,,7014,tt0069369,fr,Themroc,"Made without proper language, just gibberish and grunts, ""Themroc"" is an absurdist comedy about a man who rejects every facet of normal bourgeois life and turns his apartment into a virtual cave.",2.018911,/8dAv4QXGhMsJ6rGuDgW9f5nWtVk.jpg,1973-03-01,0.0,104.0,Released,,Themroc,False,7.1,9.0,['Comedy'],"['Filmanthrope', 'Les Productions FDL']",['France'],['xx'],,"['Themroc', 'Neighbor', ""Themroc's Sister"", 'Neighbor', ""Themroc's Mother""]","['Michel Piccoli', 'Miou-Miou', 'Béatrice Romand', 'Francesca Romana Coluzzi', 'Jeanne Herviale']",Claude Faraldo,,['absurdism']
False,0,,3423,tt0064165,fr,Les Choses de la vie,"Pierre, a successful expert in building highways has a traffic accident. Being seriously wounded, he is lying waiting for death and remembering his past in flashbacks.",2.349658,/rvgQuwSZXZIwB4NChWrVXEGfU8N.jpg,1970-03-13,0.0,89.0,Released,,The Things of Life,False,6.9,21.0,['Drama'],"['Sonocam', 'Lira Films', 'Fida Cinematografica']","['Switzerland', 'France', 'Italy']",['fr'],,"['Pierre Bérard', 'Hélène', 'Catherine Bérard', 'François', 'Bertrand Bérard']","['Michel Piccoli', 'Romy Schneider', 'Lea Massari', 'Jean Bouise', 'Gérard Lartigau']",Claude Sautet,Claude Sautet,"['car crash', 'extramarital affair']"
False,0,,260399,tt0855739,en,Building a Broken Mousetrap,A film by Jem Cohen,0.003563,/7iJ2H5rNWfX4GM2hUivEbyU0fve.jpg,2006-03-21,0.0,61.0,Released,,Building a Broken Mousetrap,False,0.0,0.0,['null'],['null'],['null'],['null'],,['null'],['null'],Jem Cohen,,['null']
False,0,,15602,tt0113228,en,Grumpier Old Men,"A family wedding reignites the ancient feud between next-door neighbors and fishing buddies John and Max. Meanwhile, a sultry Italian divorcée opens a restaurant at the local bait shop, alarming the locals who worry she'll scare the fish away. But she's less interested in seafood than she is in cooking up a hot time with Max.",11.7129,/6ksm1sjKMFLbO7UY2i6G1ju9SML.jpg,1995-12-22,0.0,101.0,Released,Still Yelling. Still Fighting. Still Ready for Love.,Grumpier Old Men,False,6.5,92.0,"['Romance', 'Comedy']","['Warner Bros.', 'Lancaster Gate']",['United States of America'],['en'],Grumpy Old Men Collection,"['Max Goldman', 'John Gustafson', 'Ariel Gustafson', 'Maria Sophia Coletta Ragetti', 'Melanie Gustafson']","['Walter Matthau', 'Jack Lemmon', 'Ann-Margret', 'Sophia Loren', 'Daryl Hannah']",Howard Deutch,,"['fishing', 'best friend', 'duringcreditsstinger', 'old men']"
False,8700000,http://www.warnerbros.com/movies/home-entertainment/scanner-darkly-a/d7c290af-c285-41c4-a4d6-efb3a86b3893.html,3509,tt0405296,en,A Scanner Darkly,An undercover cop in a not-too-distant future becomes involved with a dangerous new drug and begins to lose his own identity as a result.,11.643026,/wS0QhF2RTwap84BKGr9hKHzNAMx.jpg,2006-05-25,7659918.0,100.0,Released,Everything Is Not Going To Be OK,A Scanner Darkly,False,6.8,540.0,"['Animation', 'Science Fiction', 'Thriller']","['Thousand Words', 'Warner Independent Pictures (WIP)', 'Detour Filmproduction', 'Section Eight Productions']",['United States of America'],['en'],,"['Fred/Bob Arctor', 'Donna Hawthorne', 'Ernie Luckman', 'James Barris', 'Brown Bear Lodge Host']","['Keanu Reeves', 'Winona Ryder', 'Woody Harrelson', 'Robert Downey Jr.', 'Mitch Baker']",Richard Linklater,Richard Linklater,"['california', 'detective', 'based on novel', 'dream', 'undercover', 'cocaine', 'brain', 'exam', 'future', 'test', 'dystopia', 'assignment', 'cyberpunk', 'drug', 'surveillance', 'totalitarian', 'corporation', 'substance', 'schizophrenic', 'condition', 'neo-noir']"
False,61733,,59852,tt1520494,en,Blinky™,"A story about a boy, his robot and the consequences of his anger at the disintegration of his parents marriage.",1.750012,/oYhYHGcvDbSCIxKdREiYnkoxT9B.jpg,2011-03-21,0.0,13.0,Released,"Soon Every Home Will Have a Robot Helper. Don't Worry, Your Kids Are Safe.",Blinky™,False,6.7,34.0,"['Horror', 'Science Fiction']",['null'],"['United States of America', 'Ireland']",['en'],,"['Alex Neville', 'Mrs. Neville', 'Mr. Neville', 'Infomercial Mother', 'Infomercial Father']","['Max Records', 'Jenni Fontana', 'James Nardini', 'Caroline Rich', 'Corbin Timbrook']",Ruairi Robinson,,['short']
False,0,http://www.ranbou-movie.com/,136070,tt1569488,ja,乱暴と待機,"Director Tominaga Masanori (Pandora's Box) brings Motoya Yukiko's offbeat play Ranbo to Taiki to the big screen in a juicy, neurotic tangle of love, hate and voyeurism. Hidenori (Asano Tadanobu) and Nanase (Minami) have lived together for ten years in a tense, platonic relationship. The wheels of change are set in motion when married couple Takao (Yamada Takayuki) and Azusa (Koike Eiko) move in next door. After Hidenori catches Nanase and Takao having an affair, he becomes obsessed with watching Nanase through a peephole, and planning his cruel revenge.",1.045343,/piCJdxdSjC5bf2LbXbTSSQ3TOr1.jpg,2010-10-09,0.0,97.0,Released,,Vengeance Can Wait,False,6.7,5.0,"['Romance', 'Comedy', 'Drama']","['Sony Music Entertainment Japan', 'King Record Co.', 'Media Factory']",['Japan'],['ja'],,"['Hidenori Yamane', 'Nanase Ogawa', 'Azusa Kanamori', 'Banjo Takai']","['Tadanobu Asano', 'Minami', 'Eiko Koike', 'Takayuki Yamada']",Masanori Tominaga,Masanori Tominaga,['wetting pants']
False,0,,90879,tt0079912,en,"Skatetown, U.S.A.",A street-gang leader challenges a handsome young skater in a championship contest at the local roller-disco rink.,0.002001,/fp8Dycx2xTgBdasEeV4lD5dEJlm.jpg,1979-10-01,0.0,98.0,Released,The Rock and Roller Disco Movie of the Year!,"Skatetown, U.S.A.",False,6.5,2.0,['Comedy'],"['Rastar Pictures', 'Skatetown', 'KBC']",['United States of America'],['en'],,"['Richie', 'Harvey Ross', 'Frankey', 'Susan', 'Elvira']","['Scott Baio', 'Flip Wilson', 'Ron Palillo', 'Maureen McCormick', 'Ruth Buzzi']",William A. Levey,Nick Castle,"['rollerskates', 'disco', 'campy', 'rollerskating']"
False,0,,113217,tt0242747,en,Out of Sync,"Roger Deacon, a down-and-out record producer, is given the job of making a singing star out of an industry mogul's girlfriend, an attractive but talentless starlet. He discovers a housewife with a powerful singing voice and decides to secretly use her to lip sync the other woman's voice for record recordings as a path to fame for her and him.",0.301324,/gSbDM3lzHJRi4JBxLYjPltXENa4.jpg,2000-07-12,0.0,93.0,Released,What you see isn't necessarily what you hear.,Out of Sync,False,0.0,0.0,"['Drama', 'Comedy', 'Music']","['Hearst Entertainment Productions', 'TVA International', 'VH1 Original Movies']","['Canada', 'United States of America']",['en'],,"['Maggie Stanley', 'Roger Deacon', 'Lowell Levitt', 'Sidney Golden', 'Skeesix']","[""Gail O'Grady"", 'Peter Outerbridge', 'Stewart Bick', 'Harvey Atkin', 'Richard Chevolleau']",Graeme Campbell,,"['record producer', 'lip synching']"
False,0,http://www.wearewhatweare.co.uk/index.php,50272,tt1620604,es,Somos lo que hay,"A middle-aged man dies in the street, leaving his widow and three children destitute. The devastated family is confronted not only with his loss but with a terrible challenge - how to survive. For they are cannibals. They have always existed on a diet of human flesh consumed in bloody ritual ceremonies... and the victims have always been provided by the father. Now that he is gone, who will hunt? Who will lead them? How will they sate their horrific hunger? The task falls to the eldest son, Alfredo, a teenage misfit who seems far from ready to accept the challenge... But without human meat the family will die.",1.881046,/9joCbgvO0wL8dqMab0yX7iUlFJ4.jpg,2010-11-12,0.0,90.0,Released,Young. Wild. Hungry.,We Are What We Are,False,5.9,20.0,"['Horror', 'Thriller']",['Centro de Capacitación Cinematográfica (CCC)'],['Mexico'],['es'],,"['Sabina', 'Alfredo', 'Julián', 'Patricia', 'Adriana']","['Paulina Gaitán', 'Francisco Barreiro', 'Alan Chávez', 'Carmen Beato', 'Adrián Aguirre']",Jorge Michel Grau,Jorge Michel Grau,"['murder', 'family relationships', 'centro de capacitación cinematográfica (ccc)']"
False,0,,9313,tt0120744,en,The Man in the Iron Mask,"Years have passed since the Three Musketeers, Aramis, Athos and Porthos, have fought together with their friend, D'Artagnan. But with the tyrannical King Louis using his power to wreak havoc in the kingdom while his twin brother, Philippe, remains imprisoned, the Musketeers reunite to abduct Louis and replace him with Philippe.",7.960605,/mNbLk9qdBMnzBFWBrjy3Nuw9Ovi.jpg,1998-03-12,0.0,132.0,Released,For the honor of a king. And the destiny of a country. All for one.,The Man in the Iron Mask,False,6.3,1052.0,"['Action', 'Adventure', 'Drama']",['United Artists Corporation'],"['United Kingdom', 'United States of America']",['en'],,"['King Louis XIV / Philippe', 'Aramis', 'Porthos', ""D'Artagnan"", 'Athos']","['Leonardo DiCaprio', 'Jeremy Irons', 'Gérard Depardieu', 'Gabriel Byrne', 'John Malkovich']",Randall Wallace,Randall Wallace,"['france', 'swordplay', 'mask', 'musketeer']"
False,0,,43338,tt0045907,es,La ilusión viaja en tranvía,"Confronted with the unfortunate news that their favorite Streetcar, no. 133, is going to be decommissioned, two Municipal Transit workers get drunk and decide to ""take 'er for one last spin,"" as it were. Unfortunately, the ""one last spin"" ends up being an all-night and all-day scramble to stay out of trouble, as they are confronted with situation after sometimes bizarre situation that prevents them from returning the ""borrowed"" Streetcar!",0.282481,/a1K3ONz6KegsOibuaWcUnnX1ubH.jpg,1954-01-01,0.0,90.0,Released,,Illusion Travels by Streetcar,False,5.7,7.0,"['Adventure', 'Comedy', 'Drama']",['Clasa Films Mundiales'],['Mexico'],['es'],,"['Lupita', ""Juan Godínez 'Caireles'"", ""Tobías Hernández 'Tarrajas'"", 'Papá Pinillos', 'Don Manuel']","['Lilia Prado', 'Carlos Navarro', 'Fernando Soto', 'Agustín Isunza', 'Miguel Manzano']",Luis Buñuel,,"['mexico', 'pharmacist', 'butcher', 'beer', 'meat', 'working class', 'car accident', 'corn', 'tequila', 'stroke', 'streetcar', '1950s']"
False,0,,62762,tt0065999,en,Long hu dou,"Lei Ming, a noble young martial arts student who doesn't know the meaning of giving up. He faces a treacherous, blood-thirsty Japanese karate expert, which leads to many memorable battles as well as several unforgettable training sequences.",0.8330700000000001,/jUceD1CcsjhdhUx7Lbe7Oy9V9OO.jpg,1970-11-26,0.0,90.0,Released,See The Sweeping Hand of Death Strike Without Mercy!,The Chinese Boxer,False,6.9,8.0,"['Action', 'Foreign']",['Shaw Brothers'],['Hong Kong'],['zh'],Chinese Boxer Collection,"['Lei Ming', 'Master Kita', 'Li Siao Ling', 'Diao-Erh', 'Master Li Chun-Hai']","['Jimmy Wang Yu', 'Lo Lieh', 'Wang Ping', 'Chiu Hung', 'Fang Mian']",Jimmy Wang Yu,,"['martial arts', 'mixed martial arts']"
False,0,,52605,tt1712573,en,Strapped,"A routine trick propels a tall, dark, cynical hustler into a series of life-changing encounters in this drama. But this amicable and sexually efficient rent boy begins to look at himself differently when he finds himself lost in a maze-like apartment building. As he wanders through the building, he tricks with a variety of johns; sex is the commonality, but out of that commodity comes raw, unguarded emotions for all.",1.307499,/3Q9u38MenIKffsYDxJSRv00dsP9.jpg,2010-09-24,0.0,95.0,Released,,Strapped,False,6.1,17.0,['Drama'],['TLA Releasing'],['United States of America'],['en'],,"['Hustler', 'Gary', 'Jacob', 'John', 'Gypsy Troubadour']","['Ben Bonenfant', 'Nick Frangione', 'Raphael Barker', 'Artem Mishin', 'Michael Carlisi']",Joseph Graham,,"['gay', 'independent film']"
False,2000000,,139325,tt2062645,es,Hecho en México,"From Diego Luna and Alejandro Fernandez, to Carla Morrison and Chavela Vargas, Duncan Bridgeman weaves a cinematic tapestry composed of original songs and insights from the most iconic artists and performers of contemporary Mexico. With striking visuals, the movie captures the rich diversity of Mexican geography, art, music, and culture. It is a rare look at the country's real identity, and an unparalleled celebration of what it truly means to be ""Hecho en Mexico.""",0.447095,/mAf2dinqxxwkxIO4kSn2WMFgAiO.jpg,2012-09-21,0.0,98.0,Released,,Made in Mexico,False,5.8,4.0,"['Music', 'Foreign', 'Documentary', 'History']",['El Mall'],['Mexico'],['es'],,"['Adanowsky', 'Hector Aguilar Camin', 'Ruben Albarran', 'Amandititia', 'Sergio Arau']","['Adanowsky', 'Hector Aguilar Camin', 'Ruben Albarran', 'Amandititia', 'Sergio Arau']",Duncan Bridgeman,,['null']
False,0,,76833,tt0057268,it,Maciste all'Inferno,Maciste travels to Hell to find a witch and make her undo a curse she put on the surface world.,0.08323,/dOIBQAsvyhMpr0q9TTwb30u4Xap.jpg,1962-04-11,0.0,91.0,Released,"After the fires of Hades and frenzied attacks by ferocious beasts, there remained only the venom of 'The Witch's Curse'",The Witch's Curse,False,5.0,1.0,"['Adventure', 'Fantasy', 'Horror']",['Panda Film'],['Italy'],['it'],,"['Maciste', 'Fania', 'Young Martha Gunt', 'Judge Parrish', 'Doctor']","['Kirk Morris', 'Hélène Chanel', 'Vira Silenti', 'Andrea Bosic', 'Charles Fawcett']",Riccardo Freda,,"['witch', 'castle', 'hell', 'curse', 'good vs evil', 'redemption', 'muscleman', 'witchcraft', 'cyclops', 'sword and sandal', 'peplum', 'cannibalism']"
False,0,,6436,tt0117729,en,Star Command,"A bunch of young and impulsive space cadets make their first real flight in space and realize that the attack they suffered wasn't a training mission. They face the Enemy alone and have the chance to save the world, and maybe to prevent the war? Can the cadets conquer the more experienced, stronger and much more evil enemy? (Written by Peter 'grin' Gervai  )",0.506128,/r1P9KwtwVu8aAXA7kvuVdkrOYNB.jpg,1996-03-11,0.0,97.0,Released,,Star Command,False,4.3,4.0,"['Drama', 'Science Fiction', 'Thriller']",['null'],['United States of America'],['en'],,"[""Kenneth 'Ken' Oort"", 'Ali McGinty', 'Tully Vallis', 'Meg Dundee', 'Yukiko Fujisaki']","['Jay Underwood', 'Jennifer Bransford', 'Chris Conrad', 'Tembi Locke', 'Kelly Hu']",Jim Johnston,Melinda M. Snodgrass,"['space mission', 'mass extinction', 'space invaders']"
False,0,,42172,tt0079271,en,Hardcore,A conservative Midwest businessman ventures into the sordid underworld of pornography in California to look for his runaway teenage daughter who is making porno films in the porno pits of Los Angeles.,2.417741,/iVen8syQ84McMqBk4NIJbsWclGe.jpg,1979-02-09,0.0,109.0,Released,"Oh my God, that's my daughter.",Hardcore,False,6.7,40.0,"['Crime', 'Drama', 'Thriller']","['Columbia Pictures Corporation', 'A-Team']",['United States of America'],['en'],,"['Jake VanDorn', 'Andy Mast', 'Niki', 'Wes DeJong', 'Ramada']","['George C. Scott', 'Peter Boyle', 'Season Hubley', 'Dick Sargent', 'Leonard Gaines']",Paul Schrader,,"['pornography', 'runaway', 'snuff', 'daughter', 'father', 'porno scene', 'suspense', 'missing girl', 'subculture', 'sex industry']"
False,12000000,http://theidenticalmovie.com/,279914,tt2326574,en,The Identical,"During the Great Depression, identical twins are separated at birth. One, Drexel Hemsley becomes a wildly successful '50s rock star, while the other, Ryan Wade, struggles to balance his passion for music and pleasing his parents, who want him to become a preacher. Finally, Ryan rebels against his parents' wishes and launches his own music career -- performing the hits of Drexel Hemsley. Ryan later learns the truth about Drexel when their fates tragically collide.",1.721715,/8pWeIpeeNhIVd1YvcYsVjnTKVmz.jpg,2014-09-05,0.0,107.0,Released,"If He is in your dream, nothing can stand against them.",The Identical,False,4.9,14.0,"['Music', 'Drama']","['City of Peace Films', 'Identical Production Company']",['United States of America'],['en'],,"['Louise Wade', 'Reece Wade', 'Helen Hemsley', 'Dino', 'Damon']","['Ashley Judd', 'Ray Liotta', 'Amanda Crew', 'Seth Green', 'Danny Woodburn']",Dustin Marcellino,,"['musician', 'twin brother', 'twins']"
False,0,,180819,tt0044612,en,Feudin' Fools,"Sach discovers that he is heir to a farm in rural hillbilly country. He and the boys go to the farm to check it out, and find themselves mixed up with feuding hillbillies and a gang of bank robbers.",0.269692,/deA5UffN77Fqx8lgbEjQ0BaHk8F.jpg,1952-09-21,0.0,63.0,Released,,Feudin' Fools,False,0.0,0.0,['Comedy'],['Monogram Pictures'],['United States of America'],['en'],The Bowery Boys,"[""Terence Aloysius 'Slip' Mahoney"", ""Horace Debussy 'Sach' Jones"", 'Tiny Smith', 'Big Jim', 'Corky']","['Leo Gorcey', 'Huntz Hall', 'Dorothy Ford', 'Lyle Talbot', 'Benny Baker']",William Beaudine,Tim Ryan,['bowery boys']
False,0,,12715,tt0091055,en,Firewalker,A pair of adventurers try to track down an ancient Aztec/Mayan/Egyptian/Apache horde of gold.,3.1508990000000003,/v8DC9qUY6KNF4tqYq7agbwFqR78.jpg,1986-11-21,11949484.0,104.0,Released,A pair of down-and-out fortune hunters cash in on high adventure!,Firewalker,False,5.0,48.0,"['Action', 'Adventure', 'Comedy']","['Cannon Group', 'Golan-Globus Productions']",['United States of America'],"['hu', 'en']",,"['Max Donigan', 'Leo Porter', 'Patricia Goodwin', 'Tall Eagle', 'El Coyote']","['Chuck Norris', 'Louis Gossett, Jr.', 'Melody Anderson', 'Will Sampson', 'Sonny Landham']",J. Lee Thompson,Robert Gosnell,"['secret passage', 'martial arts', 'gold', 'treasure', 'temple', 'voodoo', 'wretch', 'treasure hunt', 'jungle', 'human sacrifice', 'soldier', 'drinking', 'central america', 'disguise', 'catfight', 'pretty woman', 'aztec indian', 'wisecrack humor', 'buddy comedy', 'bar fight', 'woman in peril', 'stranded in the desert']"
False,0,,61048,tt0049815,en,The Swan,"Princess Beatrice's days of enjoying the regal life are numbered unless her only daughter, Princess Alexandra, makes a good impression on a distant cousin when he pays a surprise visit to their palace. Prince Albert has searched all over Europe for a bride and he's bored by the whole courtship routine. He is more interested in the estate's dairy than Alexandra's rose garden. And then he starts playing football with the tutor and Alexandra's brothers. Invite the tutor to the ball that night and watch how gracefully Alexandra dances with him.",0.36218,/dEodQdDqIphiUdKxwUS2sOeSfZq.jpg,1956-04-26,0.0,104.0,Released,,The Swan,False,6.7,5.0,"['Comedy', 'Drama', 'History', 'Romance']",['null'],['null'],['en'],,"['Princess Alexandra', 'Prince Albert', 'Dr. Nicholas Agi', 'Queen Maria Dominika', 'Princess Beatrix']","['Grace Kelly', 'Alec Guinness', 'Louis Jourdan', 'Agnes Moorehead', 'Jessie Royce Landis']",Charles Vidor,,"['prince', 'princess', 'tutor']"
False,0,,64566,tt1623742,en,Cinema Verite,"In 1973, the Loud family became a television sensation of a new kind. It was long before a metal rock star showed his eccentric family on the small screen and decades before housewives had screaming matches with each other on camera in public. CINEMA VERITE tells the behind-the-scenes story of the groundbreaking documentary ""An American Family,"" which chronicled the lives of the Louds in the early 1970s and catapulted the Santa Barbara family to notoriety while creating a new television genre: the reality TV series.",1.131682,/yd7w9aar2b9bXVYafCxmvG6dp1G.jpg,2011-04-23,0.0,86.0,Released,,Cinema Verite,False,6.0,16.0,['Drama'],['null'],['null'],['en'],,"['Bill Loud', 'Pat Loud', 'Craig Gilbert', 'Lance Cloud', 'Michelle Loud']","['Tim Robbins', 'Diane Lane', 'James Gandolfini', 'Thomas Dekker', 'Kaitlyn Dever']",Shari Springer Berman,,['woman director']
False,0,,34703,tt1288633,en,Agallas,"Sebas es un delincuente de poca monta recién salido de prisión que decide buscar empleo en una pequeña empresa de Galicia. Pero no por vocación desde luego, sino porque algo le dice que el dueño de la empresa, Regueira, no se ha pagado el Jaguar con cangrejos. Cuando por fin es contratado, Regueira comprueba muy rápidamente que aquel joven de dientes mellados tiene agallas y decide convertirlo en su ayudante. Pero, Sebastián, tan listo y tan despiadado, ignora que forma parte de un juego que le supera...",0.08307300000000001,/bw4MIx91AQ1M2FeFbvtThe2eL6Y.jpg,2009-09-04,0.0,99.0,Released,,Agallas,False,5.5,1.0,"['Thriller', 'Drama']",['null'],['Spain'],['es'],,"['Sebas', 'Ramón Regueira', 'Antonio', 'Isolina', 'Manu']","['Hugo Silva', 'Carmelo Gómez', 'Carlos Sante', 'Rula Blanco', 'Tomás Lijó']",Andrés Luque,,['null']
False,25771,,67626,tt0027100,en,Three Orphan Kittens,"Three orphan kittens are entering a society house in winter and ruin the furniture. But when they're caught by the maid, the young daughter of the house ""rescues"" them from the cold out outside.",0.749343,/eltEer8wpEPyU19LVBCGiPG4PqH.jpg,1935-10-26,0.0,9.0,Released,,Three Orphan Kittens,False,6.8,12.0,['Animation'],"['Walt Disney Production', 'United Artists Pictures']",['United States of America'],['en'],,"['Mammy Two-Shoes', 'meows and child']","['Lillian Randolph', 'Marcellite Garner']",David Hand,,"['disney short', 'silly symphony', 'kitten']"
False,0,,329004,tt2580382,en,The Survivalist,"In a time of starvation, a survivalist lives off a small plot of land hidden deep in forest. When two women seeking food and shelter discover his farm, he finds his existence threatened.",8.126324,/hd491WgKPxeQus2LnvFbYmyUFmt.jpg,2015-04-15,0.0,104.0,Released,,The Survivalist,False,6.2,89.0,"['Drama', 'Science Fiction', 'Thriller']","['K5 International', 'British Film Institute (BFI)', 'Northern Ireland Screen', 'The Fyzz Facility', 'Fyzz Facility Film One, The', 'Goldcrest']",['United Kingdom'],['en'],,"['Milja', 'Survivalist', 'Kathryn', 'The Forager', 'Gaunt man']","['Mia Goth', 'Martin McCann', 'Olwen Fouéré', 'Barry Ward', 'Andrew Simpson']",Stephen Fingleton,,"['male nudity', 'female nudity', 'sex', 'nudity', 'post-apocalyptic', 'knife', 'forest', 'rifle', 'food', 'pregnancy', 'bow and arrow', 'masturbation', 'seed', 'starvation', 'abortion', 'very little dialogue']"
False,0,,26761,tt0039737,en,Pursued,A hard-hitting western drama starring Mitchum as an orphan raised by a feuding family who wants to see him dead.,1.552655,/qaTKjmGJGQUixfjHiRBlTognST6.jpg,1947-03-02,0.0,101.0,Released,Robert Mitchum fights for the love of three people who want to see him dead...his family.,Pursued,False,6.2,12.0,"['Romance', 'Thriller', 'Western', 'Drama']","['Warner Bros.', 'United States Pictures']",['United States of America'],['en'],,"['Thor', 'Jeb', 'Mrs. Callum', 'Grant', 'Jake Dingle']","['Teresa Wright', 'Robert Mitchum', 'Judith Anderson', 'Dean Jagger', 'Alan Hale']",Raoul Walsh,Niven Busch,"['brother-in-law', 'self-defense', 'nightmare', 'childhood trauma', 'foster sister', 'film noir']"
False,0,,66082,tt0163180,fr,Rembrandt,,0.5615640000000001,/mPITI1vr9RaUDlyB0p3CjHNJwdv.jpg,1999-08-09,0.0,103.0,Released,,Rembrandt,False,5.8,3.0,['null'],['null'],"['France', 'Germany', 'Netherlands']",['fr'],,"['Rembrandt van Rijn', 'Hendrickje Stoffels', 'Nicolaes Tulp', 'Saskia Uylenburgh', 'Marten Soolmans']","['Klaus Maria Brandauer', 'Romane Bohringer', 'Jean Rochefort', 'Johanna ter Steege', 'Olivier Brocheriou']",Charles Matton,,"['painting', 'famous painting']"
False,0,,26172,tt0095626,en,Messenger of Death,"Wifes and children of the Mormon Orville Beecham become victims of a massacre in his own house. The police believes the crime had a religious motive. Orville doesn't give any comment on the case, is taken into protective custody. Journalist Smith persuades him to help him in the investigation - and finds out about economic motives for the murder.",8.755119,/b11aPUfLOdicBOXE7uzN0yWKMbU.jpg,1988-09-16,0.0,91.0,Released,"What the cops can't do, he will.",Messenger of Death,False,5.6,11.0,"['Action', 'Crime', 'Thriller']",['Golan-Globus'],['United States of America'],['en'],,"['Garret Smith', 'Jastra Watson', 'Homer Foxx', 'Chief Barney Doyle', 'Josephine Fabrizio']","['Charles Bronson', 'Trish Van Devere', 'Laurence Luckinbill', 'Daniel Benzali', 'Marilyn Hassett']",J. Lee Thompson,Paul Jarrico,"['mormon', 'newspaper reporter']"
False,29000000,http://www.thebossfilm.com/,323676,tt2702724,en,The Boss,"A titan of industry is sent to prison after she's caught for insider trading. When she emerges ready to rebrand herself as America's latest sweetheart, not everyone she screwed over is so quick to forgive and forget.",7.533146,/w8smnnIVlEeFwD4Z0pKPC3RN2xT.jpg,2016-04-07,78636257.0,91.0,Released,Watch your assets,The Boss,False,5.5,441.0,['Comedy'],['Universal Pictures'],['United States of America'],['en'],,"['Michelle Darnell', 'Renault', 'Claire', 'Ida Marquette', 'Scout Leader Sandy']","['Melissa McCarthy', 'Peter Dinklage', 'Kristen Bell', 'Kathy Bates', 'Kristen Schaal']",Ben Falcone,Melissa McCarthy,"['business woman', 'ex-con', 'duringcreditsstinger', 'girl scouts']"
