adult,budget,homepage,id,imdb_id,original_language,original_title,overview,popularity,poster_path,release_date,revenue,runtime,status,tagline,title,video,vote_average,vote_count,genres,production_companies,production_countries,spoken_languages,belongs_to_collection,characters,cast,director,screenplay,keywords
False,0,,47045,tt0098308,en,She's Out of Control,A Los Angeles radio-station manager's girlfriend shows his teenage daughter how to be sexy.,1.685918,/wGB8KWwGN7RLCkKpvFe9UMSpVdk.jpg,1989-04-14,12065892.0,97.0,Released,"Girls go wild, boys go crazy, and dads go nuts!",She's Out of Control,False,4.7,24.0,"['Comedy', 'Romance']","['Columbia Pictures', 'Weintraub Entertainment Group']",['United States of America'],['en'],,"['Doug Simpson', 'Katie Simpson', 'Janet Pearson', 'Doctor Fishbinder', 'Chuck Pearson']","['Tony Danza', 'Ami Dolenz', 'Catherine Hicks', 'Wallace Shawn', ""Dick O'Neill""]",Stan Dragoti,,"['girlfriend', 'daughter', 'father', 'teenager']"
False,220000000,http://marvel.com/avengers_movie/,24428,tt0848228,en,The Avengers,"When an unexpected enemy emerges and threatens global safety and security, Nick Fury, director of the international peacekeeping agency known as S.H.I.E.L.D., finds himself in need of a team to pull the world back from the brink of disaster. Spanning the globe, a daring recruitment effort begins!",89.887648,/cezWGskPY5x7GaglTTRN4Fugfb8.jpg,2012-04-25,1519557910.0,143.0,Released,Some assembly required.,The Avengers,False,7.4,12000.0,"['Science Fiction', 'Action', 'Adventure']","['Paramount Pictures', 'Marvel Studios']",['United States of America'],['en'],The Avengers Collection,"['Tony Stark / Iron Man', 'Steve Rogers / Captain America', 'Bruce Banner / The Hulk', 'Thor Odinson', 'Natasha Romanoff / Black Widow']","['Robert Downey Jr.', 'Chris Evans', 'Mark Ruffalo', 'Chris Hemsworth', 'Scarlett Johansson']",Joss Whedon,Joss Whedon,"['new york', 'shield', 'marvel comic', 'superhero', 'based on comic', 'alien invasion', 'superhero team', 'aftercreditsstinger', 'duringcreditsstinger', 'marvel cinematic universe']"
False,0,,111014,tt0195630,en,Dead Silent,"Julia Kerrbridge is working hard to become a doctor. Suddenly, Julia finds herself the guardian of her young niece, Amanda, after her parents were found murdered.",0.25961300000000004,/sWz5mkffXcywCuI3U1x1V4N8NKz.jpg,1999-01-01,0.0,95.0,Released,Words can kill.,Dead Silent,False,4.1,4.0,['Thriller'],['null'],['null'],['en'],,"['Kevin Finney', 'Julia Kerbridge', 'Amanda Meyer', 'Sitton', 'Dakins']","['Rob Lowe', 'Catherine Mary Stewart', 'Arlen Aguayo-Stewart', 'Larry Day', 'Sean Devine']",Roger Cardinal,,['null']
False,0,,165911,tt0187809,fa,درخت گلابی,A man contemplates life and compares it to a pear tree in his yard which stops producing fruit.,0.385599,/yhkoJ0lWGWdxKM0Rh3iKbIPxnRE.jpg,1998-10-18,0.0,95.0,Released,,The Pear Tree,False,6.0,3.0,"['Romance', 'Drama']",['null'],['Iran'],['fa'],,"['M', 'Mahmoud', '', 'Old gardener', '']","['Golshifteh Farahani', 'Homayoun Ershadi', 'Mohammad Reza Shaban-Noori', 'Nematollah Gorji', 'Sassan Bagherpour']",Dariush Mehrjui,Goli Taraghi,['null']
False,0,,22522,tt0064030,en,Anne of the Thousand Days,"Henry VIII of England discards one wife, Katharine of Aragon, who has failed to produce a male heir, in favor of the young and beautiful Anne Boleyn.",3.163027,/s3l8nUklueouBrYA0lkv1P1wL9.jpg,1969-12-18,0.0,145.0,Released,He was King. She was barely 18.  And in their thousand days they played out the most passionate and shocking love story in history!,Anne of the Thousand Days,False,7.0,32.0,"['Drama', 'Romance', 'History']",['Hal Wallis Productions'],['United Kingdom'],"['en', 'es']",,"['Rei Henrique VIII', 'Anna Bolena', 'Rainha Catarina de Aragão', 'Cardeal Wolsey', 'Thomas Cromwell']","['Richard Burton', 'Geneviève Bujold', 'Irene Papas', 'Anthony Quayle', 'John Colicos']",Charles Jarrott,Bridget Boland,"['england', 'king', 'henry viii']"
False,0,,18096,tt0478329,en,The Gray Man,"Early 20th century. Albert Fish, a seemingly benevolent father and grandfather who reared his family by himself after his wife deserted them, turns out to be a serial child molester and murderer. Based on a true story.",1.668772,/pJ2Td2G6DhpsbW1thH7oPy5gcXW.jpg,2007-08-30,0.0,97.0,Released,Obsessive manhunt to identify and capture a despicable serial killer,The Gray Man,False,5.8,15.0,"['Crime', 'Drama', 'Mystery', 'Thriller']",['null'],['United States of America'],"['hu', 'en']",,"['Albert Fish', 'Det. Wil King', 'Captain Ayers', 'Delia Budd', 'Albert Fish, Jr.']","['Patrick Bauchau', 'Jack Conley', 'John Aylward', 'Jillian Armenante', 'Silas Weir Mitchell']",Scott L. Flynn,,"['serial killer', 'child murder']"
False,0,,54969,tt0118931,hi,Daud,"The affable Nandu (Sanjay Dutt), a small-time crook who is hired to deliver a mysterious package to a notorious criminal named Pinky (Paresh Rawal). Feeling that he's being cheated on his delivery fee, Nandu holds out for more money, and soon finds himself on the run from both the angry gangsters and the police, who have launched a massive manhunt. Nandu and Bhavani (Urmila Matondkar), the lovely cabaret dancer who's tagging along for the ride, assume the package contains gold; both are unpleasantly surprised when it turns out to be something deadlier.",0.221302,/uz78uBEIHk08eNv6wcxeXS0DkgZ.jpg,1997-08-22,0.0,0.0,Released,Fun on the run,Daud,False,5.6,4.0,['Action'],['Murlimanohar Creations'],['India'],['hi'],,"['Nandu', 'Bhavani', 'Pinky', 'Chacko', 'Nair']","['Sanjay Dutt', 'Urmila Matondkar', 'Paresh Rawal', 'Neeraj Vora', 'Ashish Vidhyarthi']",Ram Gopal Varma,,['bollywood']
False,0,,47208,tt0213668,en,Freedom Song,"Freedom Song (2000) is a made-for-TV film based on true stories of the Civil Rights Movement in Mississippi in the 1960s. It tells the story of the struggle of African Americans to register to vote in the fictional town of Quinlan. In the midst of the Freedom Summer, a group of high school students in the small town are eager to make grassroots changes in their own community. The young activists meet resistance not only from white southerners, but from their parents, who have experienced firsthand the violence that can result from speaking out.[1] As high school students band together with the support of the Student Nonviolent Coordinating Committee, they make strides in registering African-American voters and gaining awareness for their cause.",0.027255,/fuB1nOmdZ89DIq1FAmMGZHSzQu8.jpg,2000-02-27,0.0,112.0,Released,"A father, a son and a movement that would change America forever.",Freedom Song,False,0.0,0.0,['Drama'],['null'],['United States of America'],['en'],,"['Will Walker', 'Daniel Wall', 'Evelyn Walker', 'Owen Walker', '']","['Danny Glover', 'Vondie Curtis-Hall', 'Loretta Devine', 'Vicellous Reon Shannon', 'Michael Jai White']",Phil Alden Robinson,,['null']
False,0,,319924,tt4257950,en,Russell Madness,"Russell, an undersized but big-hearted terrier, dreams of having a family of his own. After running away from his pet store, Russell gets taken in by The Ferraros, who discover their new pet pooch has incredible wrestling skills.",0.65691,/2NKe1WqfsalEYdanoAuqQL5qTfy.jpg,2015-02-21,0.0,92.0,Released,The strongest tag team is family.,Russell Madness,False,5.1,7.0,['Comedy'],['Air Bud Entertainment'],['United States of America'],['en'],,"['Mick Vaughn', 'Max', 'Hunk', 'TJ', 'Hunk (voice)']","['John Ratzenberger', 'Mason Vale Cotton', 'Crystal the Monkey', 'Fred Willard', 'Will Sasso']",Robert Vince,,"['talking animal', 'talking dog']"
False,0,,286402,tt0026180,en,Cardinal Richelieu,The cunning Cardinal Richelieu must save King Louis XIII from treachery within his inner circle.,0.387212,/5Ml2dMPpgkmt9h427JPBLp42zIA.jpg,1935-04-18,0.0,82.0,Released,,Cardinal Richelieu,False,0.0,0.0,"['History', 'Romance', 'Drama']",['20th Century Pictures'],['United States of America'],['en'],,"['Cardinal Richelieu', 'Louis XIII', 'Lenore', 'Andre de Pons', 'Queen Marie']","['George Arliss', 'Edward Arnold', ""Maureen O'Sullivan"", 'Cesar Romero', 'Violet Kemble Cooper']",Rowland V. Lee,Maude T. Howell,['null']
False,6500000,,11558,tt0075223,en,Silver Streak,"A somewhat daffy book editor on a rail trip from Los Angeles to Chicago thinks that he sees a murdered man thrown from the train. When he can find no one who will believe him, he starts doing some investigating of his own. But all that accomplishes is to get the killer after him.",8.254209,/sFGTQkoUSytqsvZm7hUrxkmVhEy.jpg,1976-12-03,51079064.0,114.0,Released,"By train, by plane, by the edge of your seat - It's the most hilarious suspense ride of your life!",Silver Streak,False,6.8,101.0,"['Comedy', 'Crime', 'Romance', 'Thriller']","['Twentieth Century Fox Film Corporation', 'Frank Yablans Presentations', 'Miller-Milkis Productions']",['United States of America'],['en'],,"['George Caldwell', ""Hildegard 'Hilly' Burns"", 'Grover Muldoon', 'Roger Devereau', 'Bob Sweet']","['Gene Wilder', 'Jill Clayburgh', 'Richard Pryor', 'Patrick McGoohan', 'Ned Beatty']",Arthur Hiller,Colin Higgins,"['sex', 'kansas', 'two man army', 'theft', 'false accusations', 'richard pryor', 'semiautomatic pistol', 'sleeping car']"
False,28000000,,23172,tt1273678,en,The Spy Next Door,"Former CIA spy Bob Ho takes on his toughest assignment to date: looking after his girlfriend's three kids, who haven't exactly warmed to their mom's beau. And when one of the youngsters accidentally downloads a top-secret formula, Bob's longtime nemesis, a Russian terrorist, pays a visit to the family.",6.663422,/5Z9QrtpXnqF5BVg7kEotNMl6uPO.jpg,2010-01-15,45236543.0,94.0,Released,"Spying is easy, Babysitting is hard",The Spy Next Door,False,5.5,351.0,"['Action', 'Comedy', 'Family']","['Robert Simonds Productions', 'Relativity Media', 'Spy Next Door']",['United States of America'],['en'],,"['Gillian', 'Larry', 'Bob Ho', 'Colton James', 'Glaze']","['Amber Valletta', 'Lucas Till', 'Jackie Chan', 'Billy Ray Cyrus', 'George Lopez']",Brian Levant,Jonathan Bernstein,['duringcreditsstinger']
False,0,,14912,tt1294969,ab,18 Year Old Virgin,"In a series of sexual mishaps, a high school senior tries to lose her virginity on the last night before graduation.",2.352048,/uOXex54cbkDDFyqT1VgD1LRwUn9.jpg,2009-01-20,0.0,86.0,Released,She Has One Night to Lose it All. Not as Easy as You'd Think.,18 Year Old Virgin,False,2.9,31.0,['Comedy'],"['Asylum, The']",['United States of America'],"['en', 'ru']",,"['Katie Powers', 'Rose', 'Spencer', 'Ryan Lambert']","['Olivia Alaina May', 'Lauren Walsh', 'Todd Leigh', 'Dustin Harnish']",Tamara Olson,,['clowning']
False,0,,52710,tt0089066,en,Détective,"Emile Chenal (Claude Brasseur) and his wife, Françoise (Nathalie Baye), leaned on boxing manager Jim Fox Warner (Johnny Hallyday) to cough up the considerable sum of money that he owes them, with both the police and the mob circling the situation. In the same hotel, Inspector Neveu (Jean-Pierre Léaud) looks into a murder that took place years before, and his storyline overlaps with the arc of the Chenals.",0.5329729999999999,/4GVqK0f4SaTkUbGvtCflacPtWq4.jpg,1985-05-10,0.0,95.0,Released,,Detective,False,6.8,7.0,"['Comedy', 'Crime', 'Drama']",['null'],['null'],['fr'],,"['William Prospero', 'Arielle', 'Inspector Neveu', 'Emile Chenal', 'Jim Fox Warner']","['Laurent Terzieff', 'Aurelle Doazan', 'Jean-Pierre Léaud', 'Claude Brasseur', 'Johnny Hallyday']",Jean-Luc Godard,Alain Sarde,['null']
False,0,,76202,tt0098615,en,Wait until spring Bandini,"Rocklin Colorado, 1925. A hard cold winter. Young Arturo Bandini loves his father Svevo, his mother Maria and his brothers. Even though his bricklayer father wastes the little money he has in the Imperial Poolhall and his time with the rich American widow, Hildegarde. Even though his beautiful and pious mother lets his father get away with that, even if his little brother wets the bed. Arturo loves them all. He also loves to play baseball, even though he has to wait until spring. And he also loves the movies ... and Rosa. But she doesn't love him ...",0.089074,/89tM3XDe3H6orrM9u5IdYKoR3Gs.jpg,1989-11-01,0.0,100.0,Released,,Wait until spring Bandini,False,6.8,2.0,['Drama'],"['Compagnie Cinématographique de France', 'Dusk']","['Belgium', 'France', 'Italy', 'United States of America']",['en'],,"['', '', '', '', '']","['Joe Mantegna', 'Ornella Muti', 'Faye Dunaway', 'Burt Young', 'Michael Bacall']",Dominique Deruddere,,['null']
False,0,,131897,tt0084079,it,Ho fatto splash,,0.444508,/ysVIaO9hKHA11L87Zaqmet3nXbw.jpg,1980-10-30,0.0,0.0,Released,,I Made a Splash,False,6.7,3.0,['null'],['null'],['null'],['null'],,"['Maurizio', 'Angela', 'Luisa', 'Carlina']","['Maurizio Nichetti', 'Angela Finocchiaro', 'Luisa Morandini', 'Carlina Torta']",Maurizio Nichetti,,['null']
False,0,,336445,tt4382824,en,Army of One,"Gary Faulkner is an ex-con, unemployed handyman, and modern day Don Quixote who receives a vision from God telling him to capture Osama Bin Laden. Armed with only a single sword purchased from a home-shopping network, Gary travels to Pakistan to complete his mission. While on his quest, Gary encounters old friends back home in Colorado, the new friends he makes in Pakistan, the enemies he makes at the CIA - and even God and Osama themselves.",5.274165,/qL4HCSbMSvpvrpIoIy8jmwoPfeY.jpg,2016-11-04,0.0,92.0,Released,,Army of One,False,5.5,64.0,['Comedy'],"['Endgame Entertainment', 'Kasbah-Film Tanger', 'Conde Nast Entertainment']",['United States of America'],['en'],,"['Gary Faulkner', 'Marci', 'God', 'Agent Simons', 'Agent Doss']","['Nicolas Cage', 'Wendi McLendon-Covey', 'Russell Brand', 'Rainn Wilson', ""Denis O'Hare""]",Larry Charles,,['history']
False,0,,49671,tt0236576,de,Paragraph 175,"During the Nazi regime, there was widespread persecution of homosexual men, which started in 1871 with the Paragraph 175 of the German Penal Code. Thousands were murdered in concentration camps. This powerful and disturbing documentary, narrated by Rupert Everett, presents for the first time the largely untold testimonies of some of those who survived.",1.095428,/jpWAael8IHvFJe50WZ1dTOY1kip.jpg,2000-01-22,0.0,81.0,Released,,Paragraph 175,False,4.2,6.0,"['History', 'Documentary']",['Channel Four Films'],"['United Kingdom', 'United States of America', 'Germany']","['en', 'fr', 'de']",,['Narrator'],['Rupert Everett'],Rob Epstein,,"['germany', 'gay', 'holocaust', 'nazis', 'adolf hitler', 'homosexuality', 'prejudice', 'nazi germany', 'human rights', 'lgbt', 'third reich', 'lgbt history']"
False,0,,46526,tt0783494,en,The Christmas Card,"US Army sergeant Cody Cullen's horror tour in Afghanistan ends when his mate Jonesy is blown to pieces while they deliver medical supplies in Nurestan. Cody is sent home to return private possessions to Jonesy's bride turned widow. On his way home he passes Nevada City, California, where he meets Faith Spelman, who writes the parish's Christmas cards to lonely soldiers, coincidentally including him, an orphan. He happens to save her dad Luke from a serious car run-over. The Spellmans invite Cody home for dinner, then the Christmas tide. He proves a great help in the family logging firm. Vietenam vet Luke wants Cody as son-in-law, but although charmed, Faith still seems committed to rarely present fiancé Paul, a wine broker.",0.260102,/9QDdTcEZwGJEVbTZew4V5ragSb8.jpg,2006-12-02,0.0,84.0,Released,,The Christmas Card,False,4.5,6.0,"['Drama', 'Romance', 'TV Movie']","['Larry Levinson Productions', 'Alpine Medien Productions', 'RHI Entertainment', 'Brosier']",['United States of America'],"['en', 'fr']",,"['Cody Cullen', 'Luke Spelman', 'Faith Spelman', 'Richard', 'Paul']","['John Newton', 'Ed Asner', 'Alice Evans', 'Peter Jason', 'Ben Weber']",Stephen Bridgewater,,"['holiday', 'christmas']"
False,0,,37309,tt0038395,en,Canyon Passage,Businessman Logan Stuart is torn between his love of two very different women in 1850s Oregon and his loyalty to a compulsive gambler friend who goes over the line.,0.719063,/cDDIYw4i4Gxr7IxMPcvn7h5lKZt.jpg,1946-07-17,0.0,92.0,Released,Every Exciting Character!,Canyon Passage,False,6.8,12.0,['Western'],['Universal Pictures'],['United States of America'],['en'],,"['Logan Stuart', 'George Camrose', 'Lucy Overmire', 'Caroline Marsh', 'Honey Bragg']","['Dana Andrews', 'Brian Donlevy', 'Susan Hayward', 'Patricia Roc', 'Ward Bond']",Jacques Tourneur,Ernest Pascal,['oregon']
False,0,,90563,tt0064036,en,The April Fools,"Newly-promoted if none too happily married Howard Brubaker leaves a rowdy Company party early with the stunning Catherine, whom it turns out is herself unhappily married - to the boss. They spend an innocent night in New York becoming more and more attracted to each other, so that when Catherine announces she intends to leave her husband and return to Paris Howard asks to go along too. In the cold light of morning problems and pressures from spouses crowd in",0.873674,/qO5xQR75G6FhlLGbBSic3p76kP.jpg,1969-05-23,0.0,95.0,Released,,The April Fools,False,6.0,3.0,"['Drama', 'Comedy', 'Romance']","['Cinema Center Films', 'Jalem Productions']",['United States of America'],['en'],,"['Howard Brubaker', 'Catherine Gunther', 'Ted Gunther', 'Potter Shrader', 'Grace Greenlaw']","['Jack Lemmon', 'Catherine Deneuve', 'Peter Lawford', 'Jack Weston', 'Myrna Loy']",Stuart Rosenberg,,['null']
False,13000000,,21575,tt1235166,fr,Un prophète,"Sentenced to six years in prison, Malik El Djebena (Tahar Rahim) is alone in the world and can neither read nor write. On his arrival at the prison, he seems younger and more brittle than the others detained there. At once he falls under the sway of a group of Corsicans who enforce their rule in the prison. As the 'missions' go by, he toughens himself and wins the confidence of the Corsican group.",6.892314999999999,/o2P7a795t4WeLT7IMf19t7ZRbXd.jpg,2009-08-26,0.0,155.0,Released,Escaping the prison of life.,A Prophet,False,7.5,398.0,"['Crime', 'Drama']","['France 2 Cinéma', 'BIM Distribuzione', 'Centre National de la Cinématographie', 'Why Not Productions', 'Celluloid Dreams', 'Canal+', 'CinéCinéma', 'Union Générale Cinématographique (UGC)', 'Région Ile-de-France', 'France 2 (FR2)', 'Sofica Soficinéma 4', 'Sofica UGC 1', 'Page 114', 'Chic Films', ""Conseil Régional de Provence-Alpes Côte d'Azur"", 'Soficinéma 5']","['France', 'Italy']","['ar', 'co', 'fr']",,"['Malik El Djebena', 'César Luciani', 'Ryad', 'Reyeb', 'Jordi']","['Tahar Rahim', 'Niels Arestrup', 'Adel Bencherif', 'Hichem Yacoubi', 'Reda Kateb']",Jacques Audiard,Jacques Audiard,"['prison', 'muslim', 'arabian', 'protection', 'mafia', 'money', 'gangster', 'spirit', 'cruelty', 'drug', 'inmate', 'arab', 'corsican']"
False,0,,42136,tt0085622,en,The Grey Fox,"Old West highwayman Bill Miner, known to Pinkertons as ""The Gentleman Bandit,"" is released in 1901 after 33 years in prison, a genial and charming old man. He goes to Washington to live and work with his sister's family. But the world has changed much while he has been away, and he just can't adjust. So he goes to Canada and returns to the only thing familiar to him -- robbery (with stagecoaches changed to trains).",0.192513,/wAKDJmxGaTqfw0MiyzlD7eqQQA4.jpg,1982-12-16,0.0,110.0,Released,"In 1901, after 33 years in San Quentin Prison, Bill Miner, ""The Gentleman Bandit"", was released into the Twentieth Century.",The Grey Fox,False,7.2,5.0,"['Western', 'Action']","['Canadian Film Development Corporation (CFDC)', 'Zoetrope Studios', 'Mercury Pictures']",['Canada'],['en'],,"['Bill Miner', 'Kate', 'Jack Budd', 'Shorty', 'Fernie']","['Richard Farnsworth', 'Jackie Burroughs', 'Ken Pogue', 'Wayne Robson', 'Timothy Webber']",Phillip Borsos,,"['train robbery', '20th century']"
False,0,http://www.linesofwellington.com/,122198,tt1928329,pt,Linhas de Wellington,"Passionate romance, brutal treachery, and selfless nobility are set against the background of Napoleon’s 1810 invasion of Portugal in Valeria Sarmiento’s intimate epic.",0.956205,/lALpvBr3YqZglDj6NsW7jFC0SRd.jpg,2012-10-13,0.0,151.0,Released,,Lines of Wellington,False,5.4,11.0,"['Drama', 'History', 'War']","['Alfama Films', 'Clap Filmes', 'France 3 Cinema']","['Portugal', 'France']","['en', 'fr', 'de', 'pt']",,"['Sargento Francisco Xavier', 'Martírio', 'D. Filipa Sanches', 'General Wellington', 'Tenente Pedro de Alencar']","['Nuno Lopes', 'Soraia Chaves', 'Marisa Paredes', 'John Malkovich', 'Carloto Cotta']",Valeria Sarmiento,Carlos Saboga,"['troops', 'cult director', 'woman director', 'wellington', '19th century']"
False,0,,21753,tt0403237,en,Everything You Want,It was at a very young age that Abby found herself experimenting with the gift of art while she practically...,1.464393,/vffja6UnMwcGoR5yKuT6PDXnDew.jpg,2005-01-01,0.0,93.0,Released,Love is Just An Illusion. Until the Real Thing Comes along,Everything You Want,False,3.3,6.0,"['Comedy', 'Drama', 'Romance']",['Dream Guy Productions'],['United States of America'],['en'],,"['Abby Morrison', 'Quinn Andrews', 'Jessica Lindstrom', 'Sy', 'Calvin Dillwaller']","['Shiri Appleby', 'Nick Zano', 'Alexandra Holden', 'Orlando Seale', 'Will Friedle']",Ryan Little,Steven A. Lee,"['college', 'imaginary friend', 'love', 'based on play or musical', 'college roomate', 'aspiring artist']"
False,0,,70313,tt0044388,en,Bowery to Bagdad,The Bowery Boys find a lamp that has strange magic powers.,0.40983800000000004,/445boyxCU4gxxR3AuKUajrBtQtj.jpg,1955-01-07,0.0,64.0,Released,Abracadabra!...They're Insultin' The Sultan's Babes!,Bowery to Bagdad,False,6.8,3.0,['Comedy'],['Allied Artists Pictures'],['United States of America'],['en'],The Bowery Boys,"[""Terence Aloysius 'Slip' Mahoney"", ""Horace Debussy 'Sach' Jones"", 'Louie Dumbrowsky', ""Velma 'Cindy Lou' Calhoun"", 'Genie of the Lamp']","['Leo Gorcey', 'Huntz Hall', 'Bernard Gorcey', 'Joan Shawlee', 'Eric Blore']",Edward Bernds,Edward Bernds,"['bagdad', 'bowery boys']"
False,94,,39314,tt0041650,en,Mighty Joe Young,"After being taken from his home in Africa, Gorilla ""Joe"" is an instant hit in a Hollywood nightclub. This fun and wonderfully entertaining slant on ""King Kong"" is much better than Kong's 1934 sequel, ""Son of Kong"". This all ages adventure has superb special effects from Willis O'Brien and his protege, Ray Harryhausen.",2.812461,/hOqS7kauoEYQ09XkiMu8QOgNoBU.jpg,1949-07-27,0.0,94.0,Released,Merian Cooper's amazing adventure in the unusual!,Mighty Joe Young,False,6.7,25.0,"['Adventure', 'Fantasy', 'Drama', 'Action', 'Science Fiction']","['RKO Radio Pictures', 'Argosy Pictures']",['United States of America'],"['en', 'sw']",,"['Jill Young', 'Gregg Johnson', ""Max O'Hara"", 'Windy', 'Jones']","['Terry Moore', 'Ben Johnson', 'Robert Armstrong', 'Frank McHugh', 'Douglas Fowley']",Ernest B. Schoedsack,Ruth Rose,"['decoy', 'wrestler', 'ape', 'exotic pet', 'team roping']"
False,22000000,http://movies.disney.com/the-game-plan,13680,tt0492956,en,The Game Plan,"Bachelor football star Joe Kingman seems to have it all. He is wealthy and carefree, and his team is on the way to capturing a championship. Suddenly, he is tackled by some unexpected news: He has a young daughter, the result of a last fling with his ex-wife. Joe must learn to balance his personal and professional lives with the needs of his child.",9.627676,/v16hfzkZJj1Cs3kgNr9OLKWOlMT.jpg,2007-09-28,147880543.0,110.0,Released,"Half his size, twice the trouble ... and she's moving in.",The Game Plan,False,6.0,434.0,"['Comedy', 'Family']","['Walt Disney Pictures', 'Mayhem Pictures', 'Monkey Dance Productions']",['United States of America'],['en'],,"['Joe Kingman', 'Peyton Kelly', 'Stella Peck', 'Monique Vasquez', 'Travis Sanders']","['Dwayne Johnson', 'Madison Pettis', 'Kyra Sedgwick', 'Roselyn Sánchez', 'Моррис Честнат']",Andy Fickman,,"['american football', 'bachelor', 'sports team', 'sport', 'aerobics', 'tween girl', 'publicist']"
False,0,,72473,tt0033383,en,Belle Starr,"After her family's mansion is burned down by Yankee soldiers for hiding the rebel leader Captain Sam Starr (Scott) Belle Shirley (Tierney) vows to take revenge. Breaking Starr out of prison, she joins his small guerrilla group for a series of raids on banks and railroads, carpetbaggers and enemy troops. Belle's bravado during the attacks earns her a reputation amongst the locals as well as the love of Starr himself. The pair get married, but their relationship starts to break down when Sam Starr lets a couple of psychotic rebels into the gang, leaving Belle to wonder if he really cares about the Southern cause.",0.974261,/k1363CjT1dB5GnmdQLhYk82KZ4K.jpg,1941-09-12,0.0,82.0,Released,She Was a Wonderful Sweetheart...But a Terrible Enemy!,Belle Starr,False,6.0,3.0,['Western'],['Twentieth Century Fox Film Corporation'],['United States of America'],['en'],,"['Sam Starr', 'Belle Starr', 'Maj. Thomas Crail', 'Ed Shirley (as John Shepperd)', 'Sarah']","['Randolph Scott', 'Gene Tierney', 'Dana Andrews', 'Shepperd Strudwick', 'Elizabeth Patterson']",Irving Cummings,Lamar Trotti,"['american civil war', 'female gunfighter', 'belle starr']"
False,0,,114116,tt0064577,en,Law and Order,"LAW & ORDER surveys the wide range of work the police are asked to perform: enforcing the law, maintaining order, and providing general social services. The incidents shown illustrate how training, community expectations, socio-economic status of the subject, the threat of violence, and discretion affect police behavior.",0.174131,/w0kyuALWxSQkBHUt1i19PtM6LHg.jpg,1969-03-02,0.0,81.0,Released,,Law and Order,False,6.7,3.0,['Documentary'],['null'],['United States of America'],['en'],,['Richard Nixon'],['Richard Nixon'],Frederick Wiseman,,"['police everyday life', 'justice', 'courtroom', 'criminal investigation', 'law and order']"
