adult,budget,homepage,id,imdb_id,original_language,original_title,overview,popularity,poster_path,release_date,revenue,runtime,status,tagline,title,video,vote_average,vote_count,genres,production_companies,production_countries,spoken_languages,belongs_to_collection,characters,cast,director,screenplay,keywords
False,0,,29496,tt0066939,es,Condenados a vivir,"A wagon load of convicts on their way to prison is being escorted through the mountains by a cavalry troop. They are attacked by a bandit gang, and only a sergeant, his beautiful young daughter and an assortment of seven sadistic, murderous prisoners survive, and they are left without horses or a wagon. The sergeant must find a way to get his prisoners to their destination while protecting his daughter, watching out for the still pursuing bandits and trying to determine which one of the prisoners was the man who raped and murdered his wife.",0.24991,/qCs315KOtjGnwbYMTViqgP4nCif.jpg,1972-07-10,0.0,83.0,Released,Violence Is Their Way of Life,Cut-Throats Nine,False,6.8,5.0,"['Crime', 'Thriller', 'Western']",['Films Triunfo S.A.'],"['Italy', 'Spain']","['de', 'es']",,"['Sgt. Brown', 'Sarah Brown', ""Thomas Lawrence, 'Dandy Tom'"", ""Ray Brewster, 'The Torch'"", 'Dean Marlowe']","['Claudio Undari', 'Emma Cohen', 'Alberto Dalbés', 'Antonio Iranzo', 'Manuel Tejada']",Joaquín Luis Romero Marchent,Santiago Moncada,"['rape', 'gore', 'chain gang', 'blood', 'throat slitting', 'violence', 'disembowelment', 'spaghetti western', 'eurowestern', 'shot in the head', 'shot in the eye']"
False,0,,6884,tt0305556,en,Evil Alien Conquerors,Inept beings from the planet Kabijj land on Earth and attempt to behead all of its beings and take over the planet,0.309733,/dqrsNUTUtryFkmEwi4zqelakfJY.jpg,2003-12-03,0.0,89.0,Released,,Evil Alien Conquerors,False,4.8,4.0,"['Comedy', 'Science Fiction']",['Nada Pictures Inc.'],['United States of America'],['en'],,"['Kenny', 'My-ik', 'Du-ug', 'Croker', 'Ron']","['Michael Weston', 'Diedrich Bader', 'Chris Parnell', 'Tyler Labine', 'Elden Henson']",Chris Matheson,Chris Matheson,"['sword', 'alien', 'alien invasion', 'invasion of earth']"
False,0,,2608,tt0093476,en,Maid to Order,"Spoiled Jessie Montgomery, whose wild behavior and spending excesses cause her well-meaning but exasperated millionaire father Charles to wish he never had her, is visited by fairy godmother Stella. In an effort to save Jessie, Stella casts a spell which causes Charles to no longer have a daughter. Jessie, now penniless and without a friend, must take a maid's job to earn a living, and hopefully to learn her lesson.",1.542276,/AaYv2HVNujmYZ8fGmpgyjP6iHfe.jpg,1987-07-10,9868521.0,93.0,Released,"She was raised in a Beverly Hills mansion. Now, she's got to clean one.",Maid to Order,False,5.2,17.0,"['Comedy', 'Fantasy']",['Vista Organization'],['United States of America'],"['es', 'en']",,"['Jessie Montgomery', 'Stella Winston', 'Nick McGuire', 'Georgette Starke', 'Stan Starkey']","['Ally Sheedy', ""Beverly D'Angelo"", 'Michael Ontkean', 'Valerie Perrine', 'Dick Shawn']",Amy Holden Jones,,"['wish', 'party', 'maid', 'woman director', 'fairy godmother', 'weird couple']"
False,0,,103689,tt1754367,es,Post Tenebras Lux,"Juan and his urban family live in the Mexican countryside, where they enjoy and suffer a world apart. And nobody knows if these two worlds are complementary or if they strive to eliminate one another.",2.644964,/xhtUlOhnSgww3vUT99TppEiHfVt.jpg,2012-11-22,0.0,115.0,Released,After darkness light,Post Tenebras Lux,False,5.8,31.0,['Drama'],['null'],"['Mexico', 'France', 'Netherlands']",['es'],,"['', '', '', '', '']","['Adolfo Jimenez Castro', 'Willebaldo Torres', 'Rut Reygadas', 'Eleazar Reygadas', 'Nathalia Acevedo']",Carlos Reygadas,Carlos Reygadas,['null']
False,0,,64124,tt1235552,fr,À l'aventure,"Fed up with her present lifestyle, and more particularly sexually unsatisfied by her boyfriend Fred, Sandrine decides to find a new way in life. Intrigued by her friend Sophie, who tells her about her sexual experimentations, she will find, through various encounters, new pleasures and new experiences, whether physical or spiritual.",3.282339,/stLMvwAMxd8MBnnvjI9fjiP52lb.jpg,2008-08-29,0.0,104.0,Released,,À l'aventure,False,5.0,13.0,['Drama'],"['Moby Dick Films', 'Soficinéma 3', 'La Sorcière Rouge']",['France'],['fr'],,"['Sandrine', 'Sophie', 'Fred', 'Greg', 'Mina']","['Carole Brana', 'Lise Bellynck', 'Jocelyn Quivrin', 'Arnaud Binard', 'Nadia Chibani']",Jean-Claude Brisseau,Jean-Claude Brisseau,"['sex', 'eroticism', 'unsimulated sex']"
False,478000,http://www.mantarraya.com/index.php/fuseaction/site.movie/movID/4/lg/en/,84848,tt0445694,es,Sangre,"Diego's job is counting people as they enter a large government building. After work, he and his wife Blanca lie on the couch...",0.170569,/5lRiYNRRk4bZlNIW2vMI74dFSKj.jpg,2006-02-01,0.0,90.0,Released,,Blood,False,3.7,3.0,['Drama'],"['Mantarraya Producciones', 'Ad Vitam Production']","['France', 'Mexico']",['es'],,"['Diego', 'Karina', 'Martita', 'Blanca']","['Cirilo Recio Dávila', 'Claudia Orozco', 'Martha Preciado', 'Laura Saldaña Quintero']",Amat Escalante,,['null']
False,0,,122698,tt0056818,en,All the Way Home,"In the early 1900's Tennessee, a loving family undergoes the shock of the father's sudden, accidental death. The widow and her young son must endure the heartache of life following the tragedy, but slowly rise up from the ashes to face the hope of renewed life.",1.406094,/pjf5CrNf4t7z9MC4VlX79fmCwc4.jpg,1963-10-17,0.0,97.0,Released,Love is not a thing that grows only in the dark!,All the Way Home,False,5.5,2.0,['Drama'],"['Paramount Pictures', 'Talent Associates']",['United States of America'],['en'],,"['Mary Follet', 'Jay Follet', 'Ralph Follet', 'Aunt Hannah', 'Joel']","['Jean Simmons', 'Robert Preston', 'Pat Hingle', 'Aline MacMahon', 'Thomas Chalmers']",Alex Segal,Philip H. Reisman Jr.,"['tennessee', 'death of husband']"
False,0,,309024,tt3142366,en,Take Me to the River,"A naive California teen plans to remain above the fray at his Nebraskan family reunion, but a strange encounter places him at the center of a long-buried family secret.",1.327809,/m5mxlY7N7yoDPKXbWG5FFIHPil0.jpg,2016-03-18,0.0,90.0,Released,,Take Me to the River,False,6.2,9.0,['Drama'],['null'],['United States of America'],['en'],,"['Ryder', 'Cindy', 'Keith', 'Don', 'Molly']","['Logan Miller', 'Robin Weigert', 'Josh Hamilton', 'Richard Schiff', 'Ursula Parker']",Matt Sobel,,"['river', 'horse', 'family secrets', 'cousin cousin relationship', 'nebraska']"
False,0,http://www.callmeluckymovie.com/,316761,tt3899932,en,Call Me Lucky,"An inspiring, triumphant and wickedly funny portrait of one of comedy’s most enigmatic and important figures, CALL ME LUCKY tells the story of Barry Crimmins, a beer-swilling, politically outspoken and whip-smart comic whose efforts in the 70s and 80s fostered the talents of the next generation of standup comedians. But beneath Crimmins’ gruff, hard-drinking, curmudgeonly persona lay an undercurrent of rage stemming from his long-suppressed and horrific abuse as a child – a rage that eventually found its way out of the comedy clubs and television shows and into the political arena.",1.640786,/527ey2jvNecjsiTsF6wvpoPLuw9.jpg,2015-08-07,0.0,106.0,Released,,Call Me Lucky,False,7.2,21.0,['Documentary'],['Type 55 Films'],['United States of America'],['en'],,"['Barry Crimmins', 'David Cross', 'Patton Oswalt', 'Tom Kenny', 'Margaret Cho']","['Barry Crimmins', 'David Cross', 'Patton Oswalt', 'Tom Kenny', 'Margaret Cho']",Bobcat Goldthwait,,"['stand-up comedy', 'childhood sexual abuse']"
False,35000000,http://www.identitythiefmovie.com,109431,tt2024432,en,Identity Thief,"When a mild-mannered businessman learns his identity has been stolen, he hits the road in an attempt to foil the thief -- a trip that puts him in the path of a deceptively harmless-looking woman.",7.321172,/lOF4rI6SxgRsVLW8odsauqnhB9Z.jpg,2013-02-07,173965010.0,111.0,Released,She's having the time of his life,Identity Thief,False,5.6,1667.0,"['Comedy', 'Crime']","['Stuber Productions', 'Aggregate Films', 'DumbDumb']",['United States of America'],['en'],,"['Sandy Patterson', 'Diana', 'Harold Cornish', 'Trish Patterson', 'Julian']","['Jason Bateman', 'Melissa McCarthy', 'Jon Favreau', 'Amanda Peet', 'T.I.']",Seth Gordon,Steve Conrad,['null']
False,0,,245859,tt2141751,en,God Help the Girl,"Eve is a catastrophe—low on self-esteem but high on fantasy, especially when it comes to music. Over the course of one Glasgow summer, she meets two similarly rootless souls: posh Cass and fastidious James, and together they form a group.",6.684283,/xOyHxtqE7REEVKr5scIJSLG9LOn.jpg,2014-08-22,0.0,111.0,Released,,God Help the Girl,False,6.8,98.0,"['Comedy', 'Drama', 'Music']","['HanWay Films', 'Barry Mendel Productions', 'British Film Company']",['United Kingdom'],['en'],,"['Eve', 'James', 'Cass', 'Anton', 'Miss Browning']","['Emily Browning', 'Olly Alexander', 'Hannah Murray', 'Pierre Boulanger', 'Cora Bissett']",Stuart Murdoch,,"['anorexia', 'psychiatric hospital', 'pop music', 'lifeguard']"
False,0,,128625,tt0288203,en,Rudyland,,0.10101,,2001-08-10,0.0,0.0,,,Rudyland,False,0.0,0.0,['Documentary'],['null'],['null'],['en'],,"['Jesse Malin', 'Narrator (voice)']","['Jesse Malin', 'Susan Sarandon']",Matthew Carnahan,,['null']
False,0,http://kissthebridethemovie.net/,82432,tt0296711,en,Kiss The Bride,"Sibling drama overshadows the impending nuptials of Danni Sposato (Amanda Detmer) and her longtime boyfriend, Geoff Brancato (Johnathon Schaech). Television actress Niki (Brooke Langton) brings her manager-boyfriend, Marty (Johnny Whitworth), to meet the family for the first time, while spiky youngest sister Toni (Monet Mazur) shows off her bandmate and lover, Amy (Alyssa Milano), and driven Wall Street banker Chrissy (Vanessa Parise) flashes the status symbols of her financial success.",0.97787,/2eVnqo34aA4Rk9wA3zM0Vg3aGc5.jpg,2002-10-16,0.0,89.0,Released,"Marriage, sibling rivalry and other catastrophes.",Kiss The Bride,False,5.4,4.0,"['Comedy', 'Drama', 'Romance']","['Replay Pictures', 'Empera Pictures', 'Imageworks Entertainment International']",['United States of America'],['en'],,"[""Danisa 'Danni' Sposato"", 'Tom Terranova', ""Nicoletta 'Niki' Sposato"", ""Antonia 'Toni' Sposato"", ""Christina 'Chrissy' Sposato""]","['Amanda Detmer', 'Sean Patrick Flanery', 'Brooke Langton', 'Monet Mazur', 'Vanessa Parise']",Vanessa Parise,,"['rebel', 'sister sister relationship', 'nudity', 'banker', 'success', 'marriage', 'party', 'love', 'reunion', 'lesbian', 'wedding', 'family', 'band', 'woman director', 'actress']"
False,650000,,123879,tt0401385,en,Say Uncle,"A young artist (Peter Paige), desperate to replace the relationship he had with his recently relocated godson, is targeted by a neighborhood mom (Kathy Najimy) as a potential threat to the community.",1.287796,/i1Z3QheZbP6tcyn5PeaCt2birY5.jpg,2005-07-10,0.0,91.0,Released,The suburbs are about to get hysterical,Say Uncle,False,5.0,1.0,"['Drama', 'Comedy']",['TLA Releasing'],['United States of America'],['en'],,"['Paul', 'Maggie', 'Russell', 'Susan', 'Elise Carter']","['Peter Paige', 'Kathy Najimy', 'Anthony Clark', 'Melanie Lynskey', 'Gabrielle Union']",Peter Paige,,['null']
False,0,,76636,tt0073915,wo,Xala,"It is the dawn of Senegal's independence from France, but as the citizens celebrate in the streets we soon become aware that only the faces have changed. White money still controls the government. One official, Aboucader Beye, known by the title ""El Hadji,"" takes advantage of some of that money to marry his third wife, to the sorrow and chagrin of his first two wives and the resentment of his nationalist daughter. But he discovers on his wedding night that he has been struck with a ""xala,"" a curse of impotence. El Hadji goes to comic lengths to find the cause and remove the xala, resulting in a scathing satirical ending.",0.050018,/bwyGQIwsIHIBjh1gnhAuZqiPxG0.jpg,1975-10-01,0.0,123.0,Released,,Xala,False,7.0,5.0,['Comedy'],"['Films Domireew', 'Ste. Me. Production du Senegal']",['Senegal'],"['fr', 'wo']",,"['Hadji Aboucader Beye', 'Rama (as Miriam Niang)', ""Adja Assatu, Beye's wife"", 'Saleslady / Secretary', 'Aram, Second Wife']","['Thierno Leye', 'Myriam Niang', 'Seune Samb', 'Fatim Diagne', 'Younouss Seye']",Ousmane Sembene,,"['impotence', 'polygamy', 'wedding', 'political satire']"
False,14400000,,625,tt0087553,en,The Killing Fields,"The Killing Fields tells the real life story of a friendship between two journalists, an American and a Cambodian, during the bloody Khmer Rouge takeover of Cambodia in 1975, which lead to the death of 2-3 million Cambodians during the next four years, until Pol Pot's regime was toppled by the intervening Vietnamese in 1979.",11.460364,/pzSdpgnjJi79UboweTlFDQmRq7M.jpg,1984-11-02,34700291.0,141.0,Released,"Here, only the silent survive.",The Killing Fields,False,7.5,180.0,"['War', 'Drama', 'History']","['Goldcrest Films International', 'International Film Investors', 'Enigma Productions']",['United Kingdom'],"['pt', 'en', 'fr', 'hu', 'km']",,"['Sydney Schanberg', 'Dith Pran', 'Major Reeves, Military Attache', ""Alan 'Al' Rockoff, Photographer"", 'Dr. Sundesval']","['Sam Waterston', 'Haing S. Ngor', 'Craig T. Nelson', 'John Malkovich', 'Athol Fugard']",Roland Joffé,Bruce Robinson,"['civil war', 'journalist', 'photographer', 'vietnam', 'cambodia', 'killing fields', 'red khmer', 'pol pot', 'based on true story', 'genocide', 'based on true events']"
False,6100000,,76788,tt1705772,ta,மங்காத்தா,Vinayak and his 4 team members rob a booty of 500 crores INR. Trouble starts when two of the team betrays them.,1.145752,/tZnDKJyUYfZKKPfBgVheU9vKlUo.jpg,2011-08-31,28000000.0,149.0,Released,Strictly no rules,Mankatha,False,5.6,14.0,"['Action', 'Thriller']","['Sun Pictures', 'Ayngaran International', 'Cloud Nine Movies']",['India'],['ta'],,"['Vinayak Mahadevan', 'Prithviraj', 'Sanjana Arumugam', 'Sumanth', 'Mahat']","['Ajith Kumar', 'Arjun Sarja', 'Trisha Krishnan', 'Vaibhav Reddy', 'Mahat Raghavendra']",Venkat Prabhu,Venkat Prabhu,"['gambling', 'money laundering', 'cricket', 'heist', 'bad cop', 'cops and robbers\xa0', 'bookie']"
False,3000000,,3089,tt0040724,en,Red River,"Dunson is driving his cattle to Red River when his adopted son, Matthew, turns against him.",6.09018,/9TwFtppqU0zUvtNTIDxkV7zQebC.jpg,1948-08-26,9012000.0,133.0,Released,Big as the men who faced this challenge! Bold as the women who loved them!,Red River,False,7.3,85.0,['Western'],"['United Artists', 'Monterey Productions', 'Charles K. Feldman Group']",['United States of America'],"['en', 'de', 'it', 'es']",,"['Thomas Dunson', ""Matthew 'Matt' Garth"", 'Tess Millay', ""'Groot' Nadine"", 'Fen']","['John Wayne', 'Montgomery Clift', 'Joanne Dru', 'Walter Brennan', 'Coleen Gray']",Howard Hawks,Borden Chase,"['texas', 'dangerous', 'kansas', 'cattle drive', 'revenge', 'cattle', 'adopted child', 'cattle empire']"
False,0,,146933,tt0331072,en,The Wannabes,"The world's worst actor Danny, meets the world's worst crook Marcus and their lives are changed forever...",0.252708,/zDYRVpMyFjgzjlQFyNMoqzKc44b.jpg,2003-09-25,0.0,94.0,Released,"Kids Entertainment, It's Criminal",The Wannabes,False,0.0,0.0,['Comedy'],['null'],['null'],['null'],,"['Danny', 'Marcus', 'Kirsty', 'Jimmy King']","['Nick Giannopoulos', 'Russell Dykstra', 'Isla Fisher', 'Michael Carman']",Nick Giannopoulos,,['null']
False,0,,64765,tt0153489,en,Vam i Ne Snilos,"Vam i ne snilos... A movie about two high school kids who meet in class and fall madly in love with each other. Unfortunately, His father and her mother had a history of their own between them which creates uneasiness in both of them. Also because of that, the boy's mother is very jealous and tries to separate them. The only person that tries to help them is their teacher who has relationship problems of her own.",0.521762,/92xghFnh7WhkZWh8XVAF0TvKCot.jpg,1980-06-06,0.0,90.0,Released,,Love and Lies,False,6.4,10.0,"['Family', 'Romance']",['Gorky Film Studio'],['Russia'],['ru'],,"['Katya Shevchenko', 'Roman Lavochkin', 'Tanechka, the literature teacher', ""Lyudmila Sergeevna, Katya's mother"", ""Vera, Roman's mother""]","['Tatyana Aksyuta', 'Nikita Mikhajlovsky', 'Yelena Solovey', 'Irina Miroshnichenko', 'Lidiya Fedoseyeva-Shukshina']",Ilya Frez,,['null']
False,0,,10166,tt0100944,en,The Witches,"A young boy named Luke and his grandmother go on vacation only to discover their hotel is hosting an international witch convention, where the Grand High Witch is unveiling her master plan to turn all children into mice. Will Luke fall victim to the witches' plot before he can stop them?",8.208991000000001,/kke639pfyxMNy8LekWSBVHbljeO.jpg,1990-02-16,15360553.0,91.0,Released,Saving the world from witches is a tall order for a boy they've turned into a mouse!,The Witches,False,6.7,224.0,"['Adventure', 'Fantasy', 'Horror']","['Lorimar Film Entertainment', 'Jim Henson Productions']","['United Kingdom', 'United States of America']",['en'],,"['Miss Eva Ernst', 'Helga Eveshim', 'Luke Eveshim', 'Miss Irvine', 'Mr. Stringer']","['Anjelica Huston', 'Mai Zetterling', 'Jasen Fisher', 'Jane Horrocks', 'Rowan Atkinson']",Nicolas Roeg,Allan Scott,"['witch', 'chocolate', 'mouse', 'grandmother grandson relationship', 'bald']"
False,0,,186066,tt0134817,es,Mecánica Nacional,"A mechanic takes his family to a car race and a series of events occur which brings problems, betrayals, violence and the unexpected death of an elderly person.",0.148701,/fd19L8GeWDj2hVSgyJVvC1RiRrr.jpg,1972-12-28,0.0,105.0,Released,,National Mechanics,False,5.7,3.0,"['Comedy', 'Drama']",['Producciones Escorpión'],['Mexico'],['es'],,"['Eufemio', 'Isabel', 'Gregorio', 'Doña Lolita', 'Rosarito']","['Manolo Fábregas', 'Lucha Villa', 'Héctor Suárez', 'Sara García', 'Alma Muriel']",Luis Alcoriza,,['null']
False,0,,47587,tt0114577,en,Suite 16,"After an argument and fight with a wealthy one night stand in a posh hotel, young hustler Chris finds himself trapped inside. With nowhere to go and the cops closing in on the hotel fast, he wanders into ""Suite 16"" in a fit of despair. Inside, a handicapped and wheelchair bound Glover (Pete Postlethwaite) is held captive for the evening once discovered by Chris. However, things change the next day when Glover informs Chris that the woman he slept with is now dead; and that he surely will be sought out for her murder. Lonely and bored, Glover offers to shelter Chris for awhile while the cuts and bruises from the previous nights escapades have time to heal.",0.447431,/43P9hn4ZlE5toxcVRCVXZXiNydQ.jpg,1994-11-24,0.0,106.0,Released,,Suite 16,False,6.0,2.0,"['Thriller', 'Romance', 'Foreign']","['Corsan Productions', 'Theorema Films']","['Belgium', 'Netherlands', 'United Kingdom']","['nl', 'en']",,"['Glover', 'Chris', 'Helen']","['Pete Postlethwaite', 'Antonie Kamerling', 'Géraldine Pailhas']",Dominique Deruddere,,['null']
False,0,http://www.goodcopybadcopy.net/,22285,tt1782451,en,Good Copy Bad Copy,"Good Copy Bad Copy is a documentary about copyright and culture in the context of Internet, peer-to-peer file sharing and other technological advances.",0.400687,/w407aznoUBNn0LvMljt6a2OsDg5.jpg,2007-01-01,0.0,59.0,Released,,Good Copy Bad Copy,False,7.2,8.0,['Documentary'],['null'],['Denmark'],['en'],,"['Danger Mouse', 'Girl Talk', 'Dr. Lawrence Ferrara', 'Paul V. Licalsi', 'Herself (of Bridgeport Music)']","['Danger Mouse', 'Girl Talk', 'Dr. Lawrence Ferrara', 'Paul V. Licalsi', 'Jane Peterer']",Andreas Johnsen,,"['brazil', 'music', 'freedom of the press', 'copyright', 'intellectual property', 'nollywood, nigerian cinema', 'creative commons', 'tecno brego', 'music sampling', 'mpaa', 'bridgeport music', 'the pirate bay', 'file sharing']"
False,12000,,692,tt0069089,en,Pink Flamingos,"Notorious Baltimore criminal and underground figure Divine goes up against Connie &amp; Raymond Marble, a sleazy married couple who make a passionate attempt to humiliate her and seize her tabloid-given title as ""The Filthiest Person Alive"".",5.738871,/oRNBSoftw842k8cHQMjczZJ3z3A.jpg,1972-03-12,6000000.0,93.0,Released,An exercise in poor taste.,Pink Flamingos,False,6.2,111.0,"['Horror', 'Comedy', 'Crime']",['Dreamland Productions'],['United States of America'],['en'],,"['Divine / Babs Johnson', 'Raymond Marble', 'Cotton', 'Connie Marble', 'Crackers']","['Divine', 'David Lochary', 'Mary Vivian Pearce', 'Mink Stole', 'Danny Mills']",John Waters,John Waters,"['gay', 'trailer park', 'pop culture', 'drug dealer', 'heroin', 'fetishism', 'spanner', 'excrements ', 'disgust', 'dog dirt', 'van', 'independent film', 'adult humor', 'unsimulated sex', 'cult classic', 'drag', 'hitchhike']"
False,74000000,http://www.minionsmovie.com/,211672,tt2293640,en,Minions,"Minions Stuart, Kevin and Bob are recruited by Scarlet Overkill, a super-villain who, alongside her inventor husband Herb, hatches a plot to take over the world.",547.4882980000001,/q0R4crx2SehcEEQEkYObktdeFy.jpg,2015-06-17,1156730962.0,91.0,Released,"Before Gru, they had a history of bad bosses",Minions,False,6.4,4729.0,"['Family', 'Animation', 'Adventure', 'Comedy']","['Universal Pictures', 'Illumination Entertainment']",['United States of America'],['en'],Despicable Me Collection,"['Scarlet Overkill (voice)', 'Herb Overkill (voice)', 'Walter Nelson (voice)', 'Madge Nelson (voice)', 'Professor Flux / Tower Guard (voice)']","['Sandra Bullock', 'Jon Hamm', 'Michael Keaton', 'Allison Janney', 'Steve Coogan']",Kyle Balda,,"['assistant', 'aftercreditsstinger', 'duringcreditsstinger', 'evil mastermind', 'minions', '3d']"
False,0,,64805,tt0308131,fr,Corps à corps,"Laura Bartelli is a stripper in a French bar. She retires after a moody landscape architect named Marco Tisserand asks her to abandon her life and share his. However, after her red Volkswagen runs off the road en route to the rendezvous, she ends up scarred and comatose in a hospital. Marco stays at her bedside.",0.598955,/ijuow9qVcsda52bIZT8rnuooQev.jpg,2003-04-22,0.0,101.0,Released,,Body to Body,False,7.0,5.0,['Thriller'],['Corps à corps'],['France'],"['fr', 'ru']",,"['Laura', 'Marco', ""l'institutrice"", 'Doris']","['Emmanuelle Seigner', 'Philippe Torreton', 'Yolande Moreau', 'Vittoria Scognamiglio']",François Hanss,,['null']
False,0,,331836,tt4400058,fr,Babysitting 2,"Franck and his girlfriend Sonya, plus some of their friends go on holiday in Brazil. Franck, his friends, two girls and Sonya's grandmother leave to visit a cave, but everything goes wrong and their crazy adventures begin.",5.901413,/7fvLgXBKHniekjucoI9hnR1ug5L.jpg,2015-12-02,0.0,93.0,Released,,Babysitting 2,False,6.6,368.0,['Comedy'],"['M6 Films', 'Axel Films', 'Madame Films']",['France'],['fr'],Babysitting,"['Franck', 'Alain', 'Sonia', 'Ernest', 'Sam']","['Philippe Lacheau', 'Christian Clavier', 'Alice David', 'Vincent Desagnat', 'Tarek Boudali']",Nicolas Benamou,,['null']
False,0,,39240,tt1315419,de,The Truth,"When a couple is taken hostage in their home by an intruder, a simple home invasion robbery turns into something much more complicated...",0.594305,/oRWnkJmzjtnPSwA0H21wt3cuh01.jpg,2010-05-20,0.0,98.0,Released,The truth... Is always complicated.,The Truth,False,5.7,6.0,['Thriller'],['RBG Films'],['United States of America'],['en'],,"['Jonathan Davenport', 'Gabriel Doyle', 'Dana Davenport', ""Gabriel's Father"", ""Gabriel's Mother""]","['John Heard', 'Brendan Sexton III', 'Erin Cardillo', 'Daniel Baldwin', 'Erica Shaffer']",Ryan Barton-Grimley,,['suspense']
False,0,,109539,tt0046384,en,The Sun Shines Bright,"John Ford weaves three ""Judge Priest"" stories together to form a good- natured exploration of honour and small-town politics in the South around the turn of the century. Judge William Priest is involved variously in revealing the real identity of Lucy Lake, reliving his Civil War memories, preventing the lynching of a youth and contesting the elections with Yankee Horace K. Maydew.",0.6382939999999999,/pTjZf6bvH75nM6AvXc1CZbocPG0.jpg,1953-05-02,0.0,92.0,Released,JUDGE BILLY PRIEST...the only man who ever called Mallie Crump a Lady,The Sun Shines Bright,False,6.6,8.0,"['Comedy', 'Drama', 'Western']",['Argosy Pictures'],['United States of America'],"['en', 'de']",,"['Judge William Pittman Priest', 'Lucy Lee Lake', 'Ashby Corwin', 'Jeff Poindexter', 'Dr. Lewt Lake']","['Charles Winninger', 'Arleen Whelan', 'John Russell', 'Stepin Fetchit', 'Russell Simpson']",John Ford,Laurence Stallings,"['dancing', 'judge', 'small town', 'kentucky', 'election', 'yankee']"
False,25000000,http://www.painandgainmovie.com/,134374,tt1980209,en,Pain & Gain,"Daniel Lugo, manager of the Sun Gym in 1990s Miami, decides that there is only one way to achieve his version of the American dream: extortion. To achieve his goal, he recruits musclemen Paul and Adrian as accomplices. After several failed attempts, they abduct rich businessman Victor Kershaw and convince him to sign over all his assets to them. But when Kershaw makes it out alive, authorities are reluctant to believe his story.",9.218002,/mFaT4CfHGlRXAWe8qS7IJHwZgeb.jpg,2013-04-18,86175291.0,130.0,Released,Their American dream is bigger than yours.,Pain & Gain,False,6.1,1595.0,"['Thriller', 'Crime', 'Action']","['Paramount Pictures', 'De Line Pictures']",['United States of America'],['en'],,"['Daniel Lugo', 'Paul Doyle', 'Adrian Doorbal', 'Victor Kershaw', 'Ed DuBois']","['Mark Wahlberg', 'Dwayne Johnson', 'Anthony Mackie', 'Tony Shalhoub', 'Ed Harris']",Michael Bay,Christopher Markus,"['miami', 'scam', 'crime', 'weight lifting', 'weightlifting', 'duringcreditsstinger']"
